{
  "schema_version": 1,
  "review_id": "a1_outcome_level_fit_review",
  "version": 1,
  "inputs": [
    {
      "path": "data/reviewed/a1-reconciliation-worklist-v1.json",
      "sha256": "b61e6d565003c5cee170db8c3660f9b96159894e39f928fe4fd71cd7075ae983"
    },
    {
      "path": "data/reviewed/level-exit-profiles-v1.json",
      "sha256": "8cd53270688f6aafadddb7beb7f8f3717d832a464f127fefd3def3a1a62da30a"
    },
    {
      "path": "data/reviewed/communicative-function-strands-v1.json",
      "sha256": "84cef12823195ce803b9f4945406188ac8ad3c20eb0968c3f385dce0605153f2"
    },
    {
      "path": "data/reviewed/performance-complexity-strands-v1.json",
      "sha256": "60c3810d624bf47dfc454b3cbc20466897baa861ca3767d9963b10053f86e70e"
    }
  ],
  "reviews": [
    {
      "candidate_id": "lesson_candidate.locate_written_personal_details",
      "original_sequence_position": 1,
      "a1_source_fit_confirmed": true,
      "profile_claim_ids": [
        "a1.exit_promise",
        "a1.reception.reading"
      ],
      "a1_fit_status": "fits_a1_boundary",
      "independence_signal": "standalone_plausible",
      "risk_codes": [],
      "rationale": "A bounded fresh reading search is an independent A1 reception outcome.",
      "review_status": "accepted_first_pass"
    },
    {
      "candidate_id": "lesson_candidate.understand_spoken_personal_introductions",
      "original_sequence_position": 2,
      "a1_source_fit_confirmed": true,
      "profile_claim_ids": [
        "a1.exit_promise",
        "a1.reception.listening"
      ],
      "a1_fit_status": "fits_a1_boundary",
      "independence_signal": "standalone_plausible",
      "risk_codes": [],
      "rationale": "Clear personal-introduction listening is a distinct A1 reception outcome.",
      "review_status": "accepted_first_pass"
    },
    {
      "candidate_id": "lesson_candidate.understand_spoken_contact_details",
      "original_sequence_position": 3,
      "a1_source_fit_confirmed": true,
      "profile_claim_ids": [
        "a1.exit_promise",
        "a1.reception.listening"
      ],
      "a1_fit_status": "fits_a1_with_scope_revision",
      "independence_signal": "standalone_plausible",
      "risk_codes": [
        "channel_or_mode_mismatch"
      ],
      "rationale": "Recording the answer adds writing transfer to a listening-only candidate; preserve listening as the mastery construct.",
      "review_status": "accepted_first_pass"
    },
    {
      "candidate_id": "lesson_candidate.give_short_self_introduction",
      "original_sequence_position": 4,
      "a1_source_fit_confirmed": true,
      "profile_claim_ids": [
        "a1.exit_promise",
        "a1.production.speaking"
      ],
      "a1_fit_status": "fits_a1_boundary",
      "independence_signal": "standalone_plausible",
      "risk_codes": [],
      "rationale": "The bounded fresh self-introduction matches A1 output independence and content.",
      "review_status": "accepted_first_pass"
    },
    {
      "candidate_id": "lesson_candidate.exchange_personal_details_orally",
      "original_sequence_position": 5,
      "a1_source_fit_confirmed": true,
      "profile_claim_ids": [
        "a1.exit_promise",
        "a1.interaction.oral"
      ],
      "a1_fit_status": "fits_a1_boundary",
      "independence_signal": "standalone_plausible",
      "risk_codes": [],
      "rationale": "A slow direct two-way personal exchange is a core A1 interaction outcome.",
      "review_status": "accepted_first_pass"
    },
    {
      "candidate_id": "lesson_candidate.complete_a_simple_information_form",
      "original_sequence_position": 6,
      "a1_source_fit_confirmed": true,
      "profile_claim_ids": [
        "a1.exit_promise",
        "a1.production.writing"
      ],
      "a1_fit_status": "fits_a1_boundary",
      "independence_signal": "standalone_plausible",
      "risk_codes": [],
      "rationale": "Accurate entry under clear labels is an independent written A1 form outcome.",
      "review_status": "accepted_first_pass"
    },
    {
      "candidate_id": "lesson_candidate.write_short_personal_profile",
      "original_sequence_position": 7,
      "a1_source_fit_confirmed": true,
      "profile_claim_ids": [
        "a1.exit_promise",
        "a1.production.writing"
      ],
      "a1_fit_status": "fits_a1_boundary",
      "independence_signal": "standalone_plausible",
      "risk_codes": [],
      "rationale": "A few uncopied personal sentences are a valid A1 written-production outcome.",
      "review_status": "accepted_first_pass"
    },
    {
      "candidate_id": "lesson_candidate.exchange_personal_details_in_writing",
      "original_sequence_position": 8,
      "a1_source_fit_confirmed": true,
      "profile_claim_ids": [
        "a1.exit_promise",
        "a1.interaction.written_online"
      ],
      "a1_fit_status": "fits_a1_boundary",
      "independence_signal": "standalone_plausible",
      "risk_codes": [],
      "rationale": "Short purposeful written exchange is distinct from profile production at A1.",
      "review_status": "accepted_first_pass"
    },
    {
      "candidate_id": "lesson_candidate.relay_predictable_person_time_or_place_details",
      "original_sequence_position": 9,
      "a1_source_fit_confirmed": true,
      "profile_claim_ids": [
        "a1.exit_promise",
        "a1.interaction.mediation"
      ],
      "a1_fit_status": "fits_a1_with_scope_revision",
      "independence_signal": "unit_synthesis_review",
      "risk_codes": [
        "ambiguous_language_direction",
        "overlap_likely"
      ],
      "rationale": "A1 mediation is valid, but input/output language direction and ownership across learned detail tasks must be explicit.",
      "review_status": "accepted_first_pass"
    },
    {
      "candidate_id": "lesson_candidate.locate_names_places_and_times_in_slow_recordings",
      "original_sequence_position": 10,
      "a1_source_fit_confirmed": true,
      "profile_claim_ids": [
        "a1.exit_promise",
        "a1.reception.listening"
      ],
      "a1_fit_status": "fits_a1_boundary",
      "independence_signal": "support_only_review",
      "risk_codes": [
        "generic_strategy_not_context_owned",
        "overlap_likely"
      ],
      "rationale": "The skill is A1, but a generic detail-listening target may be better recycled inside contact, schedule, and travel contexts.",
      "review_status": "accepted_first_pass"
    },
    {
      "candidate_id": "lesson_candidate.understand_talk_about_people_and_family",
      "original_sequence_position": 11,
      "a1_source_fit_confirmed": true,
      "profile_claim_ids": [
        "a1.exit_promise",
        "a1.reception.listening"
      ],
      "a1_fit_status": "fits_a1_boundary",
      "independence_signal": "standalone_plausible",
      "risk_codes": [],
      "rationale": "Slow family-topic comprehension is a bounded A1 listening outcome.",
      "review_status": "accepted_first_pass"
    },
    {
      "candidate_id": "lesson_candidate.describe_people_and_object_locations_orally",
      "original_sequence_position": 12,
      "a1_source_fit_confirmed": true,
      "profile_claim_ids": [
        "a1.exit_promise",
        "a1.production.speaking"
      ],
      "a1_fit_status": "fits_a1_boundary",
      "independence_signal": "merge_review",
      "risk_codes": [
        "overlap_likely"
      ],
      "rationale": "The A1 location output is valid but overlaps the later home and scene location strand.",
      "review_status": "accepted_first_pass"
    },
    {
      "candidate_id": "lesson_candidate.introduce_another_person",
      "original_sequence_position": 13,
      "a1_source_fit_confirmed": true,
      "profile_claim_ids": [
        "a1.exit_promise",
        "a1.production.speaking"
      ],
      "a1_fit_status": "fits_a1_boundary",
      "independence_signal": "merge_review",
      "risk_codes": [
        "overlap_likely"
      ],
      "rationale": "Introducing another person is A1 but can extend the self-introduction and social-exchange cycle.",
      "review_status": "accepted_first_pass"
    },
    {
      "candidate_id": "lesson_candidate.exchange_information_about_family_and_friends",
      "original_sequence_position": 14,
      "a1_source_fit_confirmed": true,
      "profile_claim_ids": [
        "a1.exit_promise",
        "a1.interaction.oral"
      ],
      "a1_fit_status": "fits_a1_boundary",
      "independence_signal": "standalone_plausible",
      "risk_codes": [],
      "rationale": "Predictable family questions and answers form a valid A1 interaction outcome.",
      "review_status": "accepted_first_pass"
    },
    {
      "candidate_id": "lesson_candidate.describe_a_family_or_known_person",
      "original_sequence_position": 15,
      "a1_source_fit_confirmed": true,
      "profile_claim_ids": [
        "a1.exit_promise",
        "a1.production.speaking"
      ],
      "a1_fit_status": "fits_a1_boundary",
      "independence_signal": "standalone_plausible",
      "risk_codes": [],
      "rationale": "A short supported description of known people is a coherent A1 spoken outcome.",
      "review_status": "accepted_first_pass"
    },
    {
      "candidate_id": "lesson_candidate.write_simple_people_profile_cards",
      "original_sequence_position": 16,
      "a1_source_fit_confirmed": true,
      "profile_claim_ids": [
        "a1.exit_promise",
        "a1.production.writing"
      ],
      "a1_fit_status": "fits_a1_boundary",
      "independence_signal": "merge_review",
      "risk_codes": [
        "overlap_likely"
      ],
      "rationale": "The writing is A1 but substantially recycles the personal-profile and known-person outcomes.",
      "review_status": "accepted_first_pass"
    },
    {
      "candidate_id": "lesson_candidate.write_a_short_message_to_a_friend",
      "original_sequence_position": 17,
      "a1_source_fit_confirmed": true,
      "profile_claim_ids": [
        "a1.exit_promise",
        "a1.interaction.written_online"
      ],